{
  "schemaVersion": 1,
  "modelId": "brake-condition-demo-v1",
  "modelVersion": "1.0.0",
  "modelConfigSha256": "ea74cda63116d1f9fc969ec292aedb7cd0935ae899775bd8bcd73c230190e028",
  "profile": "DEMO_PRECONDITIONED",
  "generation": 1,
  "wearIndex": 62,
  "conditionScore": 38,
  "conditionBand": "INSPECTION_RECOMMENDED",
  "lastAppliedSourceEventId": "4cba2d80-c04a-4d24-9f03-f4a85d56da13",
  "lastAssessmentId": "a8ff857c-a7ca-5a59-a3fc-4e4ae90ffe3a",
  "recentSourceEventIds": ["4cba2d80-c04a-4d24-9f03-f4a85d56da13"],
  "producerEpoch": "aaaaaaaa-aaaa-4aaa-8aaa-aaaaaaaaaaaa",
  "nextAdvisorySequence": 1
}
